{
  "schema_version": 4,
  "software": "nodejs",
  "version": "23.4.0",
  "packages": {
    "nodejs": {
      "filename": "node-v23.4.0-linux-x64.tar.xz",
      "sha256": "c78502b5b786d950fa2f9fa5575704e36ab0b120693f3470f26ef4aa3082327f",
      "url": "https://nodejs.org/dist/v23.4.0/node-v23.4.0-linux-x64.tar.xz",
      "version": "23.4.0",
      "metadata": {
        "bundled_components": {
          "npm": "10.9.2"
        },
        "format": "xz",
        "provides": [
          "node",
          "corepack"
        ],
        "role": "runtime"
      }
    },
    "npm": {
      "filename": "npm-10.9.2.tgz",
      "sha256": "5cd1e5ab971ea6333f910bc2d50700167c5ef4e66da279b2a3efc874c6b116e4",
      "url": "https://registry.npmjs.org/npm/-/npm-10.9.2.tgz",
      "version": "10.9.2",
      "metadata": {
        "format": "tgz",
        "paired_with": {
          "nodejs": "23.4.0"
        },
        "provides": [
          "npm",
          "npx"
        ],
        "role": "package-manager"
      }
    }
  },
  "metadata": {
    "language": "javascript",
    "platform": {
      "arch": "x86_64",
      "libc": "gnu",
      "os": "linux"
    }
  }
}
