{
  "schema_version": 4,
  "software": "rust",
  "version": "1.48.0",
  "packages": {
    "rustup-init": {
      "filename": "rustup-init",
      "sha256": "dda7234360b7f578ca8b0ddcb80145646fa61a67c1720a5abc7051b35c9fcb71",
      "url": "https://static.rust-lang.org/rustup/dist/x86_64-unknown-linux-gnu/rustup-init",
      "version": "latest",
      "metadata": {
        "format": "binary",
        "provides": [
          "rustup"
        ],
        "role": "installer"
      }
    },
    "rust": {
      "filename": "rust-1.48.0-x86_64-unknown-linux-gnu.tar.gz",
      "sha256": "950420a35b2dd9091f1b93a9ccd5abc026ca7112e667f246b1deb79204e2038b",
      "url": "https://static.rust-lang.org/dist/rust-1.48.0-x86_64-unknown-linux-gnu.tar.gz",
      "version": "1.48.0",
      "metadata": {
        "format": "tar.gz",
        "provides": [
          "rustc",
          "cargo",
          "rust-std"
        ],
        "role": "toolchain",
        "target": "x86_64-unknown-linux-gnu"
      }
    },
    "rustc": {
      "filename": "rustc-1.48.0-x86_64-unknown-linux-gnu.tar.gz",
      "sha256": "aa4a96b010e0d4573e6a1fec230beaadaae6cdce2bb4befeee7b1c081ee9ef8c",
      "url": "https://static.rust-lang.org/dist/rustc-1.48.0-x86_64-unknown-linux-gnu.tar.gz",
      "version": "1.48.0",
      "metadata": {
        "format": "tar.gz",
        "provides": [
          "rustc"
        ],
        "role": "compiler",
        "target": "x86_64-unknown-linux-gnu"
      }
    },
    "cargo": {
      "filename": "cargo-1.48.0-x86_64-unknown-linux-gnu.tar.gz",
      "sha256": "52bf632e337a5e7464cb961766638e30dfa28edb3036428296678d1aaf7d8ede",
      "url": "https://static.rust-lang.org/dist/cargo-1.48.0-x86_64-unknown-linux-gnu.tar.gz",
      "version": "1.48.0",
      "metadata": {
        "format": "tar.gz",
        "provides": [
          "cargo"
        ],
        "role": "package-manager",
        "target": "x86_64-unknown-linux-gnu"
      }
    },
    "rust-std": {
      "filename": "rust-std-1.48.0-x86_64-unknown-linux-gnu.tar.gz",
      "sha256": "2e7152e5d24cea7e44e6645ebbc0387cbe1c7059b54d95d8ea3afe298ac8b2fc",
      "url": "https://static.rust-lang.org/dist/rust-std-1.48.0-x86_64-unknown-linux-gnu.tar.gz",
      "version": "1.48.0",
      "metadata": {
        "format": "tar.gz",
        "provides": [
          "rust-std"
        ],
        "role": "standard-library",
        "target": "x86_64-unknown-linux-gnu"
      }
    },
    "rust-source": {
      "filename": "rustc-1.48.0-src.tar.gz",
      "sha256": "0e763e6db47d5d6f91583284d2f989eacc49b84794d1443355b85c58d67ae43b",
      "url": "https://static.rust-lang.org/dist/rustc-1.48.0-src.tar.gz",
      "version": "1.48.0",
      "metadata": {
        "format": "tar.gz",
        "provides": [
          "rust-src"
        ],
        "role": "source",
        "target": "x86_64-unknown-linux-gnu"
      }
    }
  },
  "metadata": {
    "language": "rust",
    "platform": {
      "arch": "x86_64",
      "libc": "gnu",
      "os": "linux"
    }
  }
}
