{
  "schema_version": 4,
  "software": "go",
  "version": "1.18.10",
  "packages": {
    "go": {
      "filename": "go1.18.10.linux-amd64.tar.gz",
      "sha256": "5e05400e4c79ef5394424c0eff5b9141cb782da25f64f79d54c98af0a37f8d49",
      "url": "https://dl.google.com/go/go1.18.10.linux-amd64.tar.gz",
      "version": "1.18.10",
      "metadata": {
        "format": "tar.gz",
        "provides": [
          "go",
          "gofmt"
        ],
        "role": "sdk"
      }
    }
  },
  "metadata": {
    "language": "go",
    "platform": {
      "arch": "x86_64",
      "libc": "gnu",
      "os": "linux"
    }
  }
}
