{
  "schema_version": 4,
  "software": "rust",
  "version": "1.33.0",
  "packages": {
    "rustup-init": {
      "filename": "rustup-init",
      "sha256": "dda7234360b7f578ca8b0ddcb80145646fa61a67c1720a5abc7051b35c9fcb71",
      "url": "https://static.rust-lang.org/rustup/dist/x86_64-unknown-linux-gnu/rustup-init",
      "version": "latest",
      "metadata": {
        "format": "binary",
        "provides": [
          "rustup"
        ],
        "role": "installer"
      }
    },
    "rust": {
      "filename": "rust-1.33.0-x86_64-unknown-linux-gnu.tar.gz",
      "sha256": "6623168b9ee9de79deb0d9274c577d741ea92003768660aca184e04fe774393f",
      "url": "https://static.rust-lang.org/dist/rust-1.33.0-x86_64-unknown-linux-gnu.tar.gz",
      "version": "1.33.0",
      "metadata": {
        "format": "tar.gz",
        "provides": [
          "rustc",
          "cargo",
          "rust-std"
        ],
        "role": "toolchain",
        "target": "x86_64-unknown-linux-gnu"
      }
    },
    "rustc": {
      "filename": "rustc-1.33.0-x86_64-unknown-linux-gnu.tar.gz",
      "sha256": "54a342f718b712d8a17fd7878ebd37d22a82ebc70b59c421168cd4153fd04c2b",
      "url": "https://static.rust-lang.org/dist/rustc-1.33.0-x86_64-unknown-linux-gnu.tar.gz",
      "version": "1.33.0",
      "metadata": {
        "format": "tar.gz",
        "provides": [
          "rustc"
        ],
        "role": "compiler",
        "target": "x86_64-unknown-linux-gnu"
      }
    },
    "rust-std": {
      "filename": "rust-std-1.33.0-x86_64-unknown-linux-gnu.tar.gz",
      "sha256": "661c2ba717ae1502f002b4c6e7aeb8941685c7ea8fe7ac26ed9ede26f615b7af",
      "url": "https://static.rust-lang.org/dist/rust-std-1.33.0-x86_64-unknown-linux-gnu.tar.gz",
      "version": "1.33.0",
      "metadata": {
        "format": "tar.gz",
        "provides": [
          "rust-std"
        ],
        "role": "standard-library",
        "target": "x86_64-unknown-linux-gnu"
      }
    },
    "rust-source": {
      "filename": "rustc-1.33.0-src.tar.gz",
      "sha256": "5a01a8d7e65126f6079042831385e77485fa5c014bf217e9f3e4aff36a485d94",
      "url": "https://static.rust-lang.org/dist/rustc-1.33.0-src.tar.gz",
      "version": "1.33.0",
      "metadata": {
        "format": "tar.gz",
        "provides": [
          "rust-src"
        ],
        "role": "source",
        "target": "x86_64-unknown-linux-gnu"
      }
    }
  },
  "metadata": {
    "language": "rust",
    "platform": {
      "arch": "x86_64",
      "libc": "gnu",
      "os": "linux"
    }
  }
}
