{
  "schema_version": 4,
  "software": "gcc",
  "version": "12.2.0",
  "packages": {
    "gcc-source": {
      "filename": "gcc-12.2.0.tar.xz",
      "sha256": "e549cf9cf3594a00e27b6589d4322d70e0720cdd213f39beb4181e06926230ff",
      "url": "https://ftp.gnu.org/gnu/gcc/gcc-12.2.0/gcc-12.2.0.tar.xz",
      "version": "12.2.0",
      "metadata": {
        "format": "tar.xz",
        "provides": [
          "gcc",
          "g++",
          "gccgo",
          "gfortran"
        ],
        "role": "source",
        "upstream": "GNU FTP"
      }
    }
  },
  "metadata": {
    "install": "source build",
    "language": "c/c++",
    "platform": {
      "arch": "x86_64",
      "libc": "gnu",
      "os": "linux"
    },
    "release_date": "2022-08-19"
  }
}
