{
  "schema_version": 4,
  "software": "python",
  "version": "3.3.7",
  "packages": {
    "python-source": {
      "filename": "Python-3.3.7.tgz",
      "sha256": "992461a9598e85a45323512d4e60fa6c1d5aaef0956bf9db98733cc5aa9b05e1",
      "url": "https://www.python.org/ftp/python/3.3.7/Python-3.3.7.tgz",
      "version": "3.3.7",
      "metadata": {
        "format": "tar.gz",
        "provides": [
          "python"
        ],
        "role": "source",
        "upstream": "python.org"
      }
    },
    "uv": {
      "filename": "uv-0.13.1-py3-none-manylinux_2_17_x86_64.manylinux2014_x86_64.whl",
      "sha256": "696dcf6d807d85da978f4db8472da81dccc1254b18b52cbd1367c4d923c421e0",
      "url": "https://files.pythonhosted.org/packages/14/0b/6602a613533602e7a083e908c4375f9b0e78a94ba2e21c29b21c41a0a611/uv-0.13.1-py3-none-manylinux_2_17_x86_64.manylinux2014_x86_64.whl",
      "version": "0.13.1",
      "metadata": {
        "format": "whl",
        "paired_with": {
          "python": "3.3.7"
        },
        "provides": [
          "uv"
        ],
        "role": "package-manager",
        "source": "pypi"
      }
    }
  },
  "metadata": {
    "language": "python",
    "platform": {
      "arch": "x86_64",
      "libc": "gnu",
      "os": "linux"
    },
    "release_date": "2017-09-19"
  }
}
