{
  "schema_version": 4,
  "software": "java",
  "version": "19.0.2",
  "packages": {
    "jdk": {
      "filename": "jdk-19.0.2_linux-x64_bin.tar.gz",
      "sha256": "59f26ace2727d0e9b24fc09d5a48393c9dbaffe04c932a02938e8d6d582058c6",
      "url": "https://download.oracle.com/java/19/archive/jdk-19.0.2_linux-x64_bin.tar.gz",
      "version": "19.0.2",
      "metadata": {
        "distribution": "oracle-jdk",
        "format": "tar.gz",
        "provides": [
          "java",
          "javac",
          "jar"
        ],
        "role": "sdk",
        "vendor": "oracle"
      }
    }
  },
  "metadata": {
    "language": "java",
    "platform": {
      "arch": "x86_64",
      "libc": "gnu",
      "os": "linux"
    }
  }
}
