{
  "schema_version": 4,
  "software": "python",
  "version": "3.13.16",
  "packages": {
    "python-source": {
      "filename": "Python-3.13.16.tgz",
      "sha256": "cfac63bddf956deafb1172ca131ae5dcaafd6f95056086e233fca205593ed427",
      "url": "https://www.python.org/ftp/python/3.13.16/Python-3.13.16.tgz",
      "version": "3.13.16",
      "metadata": {
        "format": "tar.gz",
        "provides": [
          "python"
        ],
        "role": "source",
        "upstream": "python.org"
      }
    },
    "python": {
      "filename": "cpython-3.13.16+20261013-x86_64_v3-unknown-linux-gnu-pgo+lto-full.tar.zst",
      "sha256": "3d621f22b88b95211ebde067b65e597bc5988e2e4f703cbb611618e91b386582",
      "url": "https://github.com/astral-sh/python-build-standalone/releases/download/20261013/cpython-3.13.16+20261013-x86_64_v3-unknown-linux-gnu-pgo+lto-full.tar.zst",
      "version": "3.13.16",
      "metadata": {
        "abi": "gnu",
        "format": "tar.zst",
        "provides": [
          "python"
        ],
        "role": "runtime",
        "upstream": "python-build-standalone"
      }
    },
    "uv": {
      "filename": "uv-0.11.33-py3-none-manylinux_2_17_x86_64.manylinux2014_x86_64.whl",
      "sha256": "9542178978b0b6f16a7ae99e55aca039f493a1edb373a15d7993eab80a28615a",
      "url": "https://files.pythonhosted.org/packages/a3/cb/f0ccaba1bf9b0f778dc883e56f3bfb315e3d974ba36fb7432a067b459528/uv-0.11.33-py3-none-manylinux_2_17_x86_64.manylinux2014_x86_64.whl",
      "version": "0.11.33",
      "metadata": {
        "format": "whl",
        "paired_with": {
          "python": "3.13.16"
        },
        "provides": [
          "uv"
        ],
        "role": "package-manager",
        "source": "pypi"
      }
    }
  },
  "metadata": {
    "language": "python",
    "platform": {
      "arch": "x86_64",
      "libc": "gnu",
      "os": "linux"
    },
    "release_date": "2026-09-30"
  }
}
